{
  "kind": "WORKFLOW",
  "schemaVersion": 1,
  "id": "beh-nested-outer",
  "name": "Nested Outer",
  "steps": [
    {
      "kind": "STEP",
      "stepId": "call",
      "name": "Call Nested",
      "behaviour": {
        "type": "WORKFLOW",
        "workflowRef": "beh-nested-inner",
        "transition": "AUTO"
      }
    }
  ]
}
