{
  "kind": "WORKFLOW",
  "schemaVersion": 1,
  "id": "draft-workflow",
  "name": "Draft Workflow",
  "steps": [
    {
      "kind": "STEP",
      "stepId": "step-1",
      "name": "Generate draft",
      "behaviour": {
        "type": "AGENT",
        "agentRef": "writer-agent",
        "transition": "AUTO"
      }
    }
  ]
}
