{
  "kind": "WORKFLOW",
  "schemaVersion": 1,
  "id": "retry-previous-spar-single",
  "name": "Retry Previous To Spar (SINGLE_STEP)",
  "steps": [
    {
      "kind": "STEP",
      "stepId": "seed",
      "name": "Seed Spar",
      "behaviour": {
        "type": "SPAR",
        "agentRef": "retry-spar-agent",
        "sparConfig": {
          "challengerAgentId": "retry-challenger",
          "maxRounds": 1,
          "resolutionPrompt": "Make a final decision."
        },
        "transition": "AUTO"
      }
    },
    {
      "kind": "STEP",
      "stepId": "retry",
      "name": "Retry Previous",
      "behaviour": {
        "type": "RETRY_PREVIOUS",
        "retryStepId": "seed",
        "retryMode": "SINGLE_STEP",
        "maxAttempts": 1,
        "fallback": {
          "kind": "STEP",
          "stepId": "fallback",
          "name": "Fallback",
          "behaviour": {
            "type": "AGENT",
            "agentRef": "retry-agent",
            "transition": "AUTO"
          }
        }
      }
    }
  ]
}
