{
  "kind": "WORKFLOW",
  "schemaVersion": 1,
  "id": "tr-approval",
  "name": "Human Approval Transition",
  "steps": [
    {
      "kind": "STEP",
      "stepId": "run",
      "name": "Run Agent",
      "behaviour": {
        "type": "AGENT",
        "agentRef": "gate-agent",
        "transition": "HUMAN_APPROVAL"
      }
    }
  ]
}
