{
  "kind": "WORKFLOW",
  "schemaVersion": 1,
  "id": "beh-input",
  "name": "Input Behaviour",
  "steps": [
    {
      "kind": "STEP",
      "stepId": "collect",
      "name": "Collect Input",
      "behaviour": {
        "type": "INPUT",
        "artifactId": "user-form",
        "transition": "AUTO"
      }
    }
  ]
}
