{
  "kind": "WORKFLOW",
  "schemaVersion": 1,
  "id": "cmd-user-prompt",
  "name": "User Prompt Command",
  "steps": [
    {
      "kind": "STEP",
      "stepId": "run",
      "name": "Run Agent",
      "behaviour": {
        "type": "AGENT",
        "agentRef": "cmd-agent",
        "transition": "AUTO"
      }
    }
  ]
}
